smartctl 7.2 2020-12-30 r5155 [aarch64-linux-5.15.89-rockchip64] (local build)
Copyright (C) 2002-20, Bruce Allen, Christian Franke, www.smartmontools.org

=== START OF READ SMART DATA SECTION ===
SMART Attributes Data Structure revision number: 16
Vendor Specific SMART Attributes with Thresholds:
ID# ATTRIBUTE_NAME          FLAG     VALUE WORST THRESH TYPE      UPDATED  WHEN_FAILED RAW_VALUE
  1 Raw_Read_Error_Rate     0x002f   200   200   051    Pre-fail  Always       -       0
  3 Spin_Up_Time            0x0027   175   173   021    Pre-fail  Always       -       4216
  4 Start_Stop_Count        0x0032   100   100   000    Old_age   Always       -       402
  5 Reallocated_Sector_Ct   0x0033   200   200   140    Pre-fail  Always       -       0
  7 Seek_Error_Rate         0x002e   200   200   000    Old_age   Always       -       0
  9 Power_On_Hours          0x0032   073   073   000    Old_age   Always       -       20327
 10 Spin_Retry_Count        0x0032   100   100   000    Old_age   Always       -       0
 11 Calibration_Retry_Count 0x0032   100   100   000    Old_age   Always       -       0
 12 Power_Cycle_Count       0x0032   100   100   000    Old_age   Always       -       387
192 Power-Off_Retract_Count 0x0032   200   200   000    Old_age   Always       -       29
193 Load_Cycle_Count        0x0032   200   200   000    Old_age   Always       -       373
194 Temperature_Celsius     0x0022   117   084   000    Old_age   Always       -       30
196 Reallocated_Event_Count 0x0032   200   200   000    Old_age   Always       -       0
197 Current_Pending_Sector  0x0032   200   200   000    Old_age   Always       -       1
198 Offline_Uncorrectable   0x0030   200   200   000    Old_age   Offline      -       0
199 UDMA_CRC_Error_Count    0x0032   200   200   000    Old_age   Always       -       0
200 Multi_Zone_Error_Rate   0x0008   200   200   000    Old_age   Offline      -       0
240 Head_Flying_Hours       0x0032   074   074   000    Old_age   Always       -       19266
241 Total_LBAs_Written      0x0032   200   200   000    Old_age   Always       -       7880056570
242 Total_LBAs_Read         0x0032   200   200   000    Old_age   Always       -       5629402727

